{
  "$schema": "https://raw.githubusercontent.com/kewe87/casehud-library/main/schema/lighting.schema.json",
  "format": 1,
  "id": "spark-rain",
  "name": {
    "de": "Funkenregen",
    "en": "Spark rain"
  },
  "description": {
    "de": "Kurze Funken in Cyan, Magenta und Violett blitzen zufällig auf.",
    "en": "Short sparks in cyan, magenta and violet flash at random."
  },
  "effect": "sparkle",
  "params": {
    "color1": "#00f0ff",
    "color2": "#ff2bd6",
    "color3": "#a855f7",
    "colors": 3,
    "speed": 45,
    "density": 35
  },
  "palette": [
    "#00f0ff",
    "#ff2bd6",
    "#a855f7"
  ],
  "tags": [
    "neon",
    "party"
  ],
  "author": "kewe87",
  "license": "CC-BY-4.0"
}
